{
  "task_id": "FTL-PROD-003",
  "title": "PRD-003: Home Hub Modulare, Design System v2.0 Applicativo, PIM Data Quality & Export (FEAT-05) e Schede Tecniche Verticali Multi-Settore con Costing L6",
  "description": "Redigere il PRD-003 di Sprint 3 che definisce: (1) l'applicazione integrale del Design System v2.0 Nike-Inspired Editorial Minimalism su tutto l'Applicativo; (2) l'architettura informativa della Home Iniziale (Launchpad dei 6 moduli principali con KPI operativi live); (3) il motore PIM Data Quality (0-100%) con gate di pubblicazione DPP ed export multicanale CSV/JSON/Shopify/B2B (FEAT-05); (4) le Schede Tecniche Verticali per Calzature, Pelletteria e Abbigliamento con tabella sviluppo consumi su scala taglie, workflow ciclo di vita PLM con snapshot BOM immutabili e segregazione costi L6.",
  "status": "done",
  "priority": "critical",
  "assignee_role": "CPO",
  "assignee_agent": "footlink-cpo",
  "created_by": "Founder",
  "created_at": "2026-10-18T22:14:00+02:00",
  "updated_at": "2026-10-18T22:20:00+02:00",
  "due_date": "2026-11-05T23:59:59+02:00",
  "estimated_effort": "M (1-3gg)",
  "actual_effort": "S (2-8h)",
  "dependencies": [
    "FTL-PROD-002",
    "FTL-MKT-002"
  ],
  "blocked_by": [],
  "output_artifacts": [
    "Azienda/docs/prd/PRD-003-home-hub-vertical-specs-data-quality-export.md",
    "Azienda/docs/prd/README.md"
  ],
  "requires_escalation": false,
  "escalation_reason": null,
  "escalation_level": "L1",
  "decision_record_id": "ADR-006",
  "tags": [
    "product",
    "PLM",
    "PIM",
    "marketing"
  ],
  "acceptance_criteria": [
    "Specifica UX/UI completa della Home Iniziale di Footlink con visibilità immediata dei 6 moduli core e navigazione rapida",
    "Mappatura del Design System v2.0 (MKT-BRAND-002) su tutti i componenti applicativi (zero dark mode SaaS, tipografia Barlow Condensed 900, bottoni pill 999px, logo SVG Dynamic Sole-Link)",
    "Specifica funzionale di FEAT-05 (PIM Data Quality Score 0-100%, gate ESPR e Syndication Export CSV/JSON/Shopify/B2B)",
    "Specifica delle Schede Tecniche Verticali (Calzature, Pelletteria, Abbigliamento), tabella sviluppo taglie e segregazione costi L6"
  ],
  "notes": "In lavorazione per Sprint 3."
}
