{
  "task_id": "FTL-CEO-008",
  "title": "Direttiva Esecutiva Sprint 6: Commesse di Produzione, Tracciabilità Lotti Conceria e Lifecycle Fasi Terzisti",
  "description": "Emettere la direttiva esecutiva di Sprint 6 per guidare la C-Suite nell'implementazione industriale delle Commesse di Produzione, nell'integrazione del passaporto conciario (lotti, metodi di concia, certificazioni LWG/ICEC, conformità REACH) e nell'orchestrazione del ciclo di vita delle lavorazioni terzisti a costo zero con segregazione L6.",
  "status": "todo",
  "priority": "critical",
  "assignee_role": "CEO",
  "assignee_agent": "footlink-ceo",
  "created_by": "Founder",
  "created_at": "2026-10-19T17:00:00+02:00",
  "updated_at": "2026-10-19T17:00:00+02:00",
  "due_date": "2026-11-25T23:59:59+02:00",
  "estimated_effort": "S (2-8h)",
  "actual_effort": null,
  "dependencies": [
    "FTL-CEO-005",
    "FTL-CEO-007"
  ],
  "blocked_by": [],
  "output_artifacts": [
    "Azienda/docs/okr/sprint-6-executive-directive.md"
  ],
  "requires_escalation": false,
  "escalation_reason": null,
  "escalation_level": "L1",
  "decision_record_id": "ADR-008",
  "tags": [
    "governance",
    "product",
    "PLM"
  ],
  "acceptance_criteria": [
    "Emissione della Direttiva Esecutiva di Sprint 6 per CPO, CTO, CGO, CRO e CMO",
    "Definizione degli obiettivi chiave (OKR) su avanzamento commesse industriali e tracciabilità conceria",
    "Presidio dei vincoli L2 (Zero Spesa Monetaria) e L6 (Segregazione Dati Industriali Riservati)"
  ],
  "notes": "Direttiva di avvio per lo Sprint 6 focalizzata sulla verticalizzazione produttiva di filiera."
}
