{
  "task_id": "FTL-GOV-007",
  "title": "ADR-010: Architettura Tassonomia Multi-Livello, Merchandising Matrix e Motore Atomico di Import/Clonazione BOM con Segregazione L6",
  "description": "Redigere e formalizzare l'ADR-010 definendo le specifiche di architettura per la tabella ricorsiva product_categories_hierarchy, i campi di classificazione commerciale per la piramide di collezione, la transazionalità atomica del motore di Deep Copy della distinta base e il protocollo di segregazione server-side L6 per i costi industriali durante esportazioni e importazioni massive, garantendo zero spesa autonoma L2.",
  "status": "done",
  "priority": "critical",
  "assignee_role": "CGO",
  "assignee_agent": "footlink-cgo",
  "created_by": "Founder",
  "created_at": "2026-10-20T19:40:00+02:00",
  "updated_at": "2026-10-20T20:10:00+02:00",
  "due_date": "2026-11-30T23:59:59+02:00",
  "estimated_effort": "S (2-8h)",
  "actual_effort": "S (2-8h)",
  "dependencies": [
    "FTL-CEO-013"
  ],
  "blocked_by": [],
  "output_artifacts": [
    "Azienda/adr/ADR-010-product-hierarchies-merchandising-classifiers-and-bom-cloning.md"
  ],
  "requires_escalation": false,
  "escalation_reason": null,
  "escalation_level": "L1",
  "decision_record_id": "ADR-010",
  "tags": [
    "governance",
    "PLM",
    "PIM"
  ],
  "acceptance_criteria": [
    "Redazione formale di ADR-010 secondo il template standard di Footlink",
    "Definizione della matrice di segregazione L6 per l'export massivo BOM tra profili Brand e Terzista a 0 EUR",
    "Verifica e conformità dei Task Object di Sprint 7 al Task Object Schema v1.0",
    "Certificazione del vincolo FinOps L2 a costo zero (0,00 EUR)"
  ],
  "notes": "Governance e presidio architetturale per lo Sprint 7."
}
