{
  "task_id": "FTL-CEO-021",
  "title": "Gestione dei modelli",
  "description": "Attualmente non è presente un'area di gestione dei modelli. Identificare tutte le informazioni che possono essere gestite a livello di modello, e togliere dalla gestione prodotti PLM. Rendere possibile l'aggancio fra un modello e più prodotti. Nel flusso logico di creazione di una collezione mi aspetto che vengano prima identificati i modelli, e poi i prodotti (realizzazioni di materiale + colore) in cui i prodotti saranno realizzati.",
  "status": "done",
  "priority": "high",
  "assignee_role": "CEO",
  "assignee_agent": "footlink-ceo",
  "created_by": "Founder (Control Center)",
  "created_at": "2026-10-28T17:34:54+02:00",
  "updated_at": "2026-10-28T18:25:00+02:00",
  "due_date": "2026-11-27T23:59:59+02:00",
  "estimated_effort": "M (1-3gg)",
  "actual_effort": "1.5gg",
  "dependencies": [],
  "blocked_by": [],
  "output_artifacts": [
    "Applicativo/database/schema.sql",
    "Applicativo/backend/app/models.py",
    "Applicativo/backend/app/database.py",
    "Applicativo/backend/app/main.py",
    "Applicativo/frontend/src/components/ProductModelsManager.tsx",
    "Azienda/adr/ADR-012-plm-ux-simplification-product-models-and-district-vendor-synergy.md"
  ],
  "requires_escalation": false,
  "escalation_reason": null,
  "escalation_level": "L2",
  "decision_record_id": "ADR-012",
  "tags": [
    "governance",
    "product",
    "PLM"
  ],
  "acceptance_criteria": [
    "Devo poter inserire modificare un nuovo modello. Agganciare o sganciare uno o più SKU ad un modello in modo semplice veloce e comodo.",
    "Tabella product_models e FK model_id su pim_commercial_items implementate.",
    "API CRUD complete per i modelli e rotte per aggancio/sgancio prodotti.",
    "UI dedicata alla gestione modelli integrata con il flusso di lavoro PLM."
  ],
  "notes": "Modellazione dati Modello 1:N Prodotti approvata con ADR-012."
}