{
  "task_id": "FTL-REV-006",
  "title": "Analisi Impatto Commerciale & FinOps Sprint 7: Riduzione TTV a < 2h, Enablement Vendite Enterprise e Tutela Gratuita Terzisti",
  "description": "Quantificare l'impatto economico e commerciale delle funzionalità di Sprint 7 su metriche di vendita e FinOps: (1) Abbattimento del Time-to-Value (TTV) di onboarding catalogo a meno di 2 ore, (2) Enablement del sales pitch enterprise per maison e PMI con demo live di caricamento massivo e clonazione BOM, (3) Analisi del pricing tier per i volumi di SKU gestiti, (4) Certificazione dell'invarianza del costo zero (0 EUR) per i façonisti terzisti e mantenimento del margine lordo SaaS > 75%.",
  "status": "done",
  "priority": "high",
  "assignee_role": "CRO",
  "assignee_agent": "footlink-cro",
  "created_by": "Founder",
  "created_at": "2026-10-20T19:40:00+02:00",
  "updated_at": "2026-10-20T20:10:00+02:00",
  "due_date": "2026-11-30T23:59:59+02:00",
  "estimated_effort": "S (2-8h)",
  "actual_effort": "S (2-8h)",
  "dependencies": [
    "FTL-CEO-013",
    "FTL-PROD-010"
  ],
  "blocked_by": [],
  "output_artifacts": [
    "Azienda/docs/finops/sprint-7-fast-onboarding-economic-impact.md"
  ],
  "requires_escalation": false,
  "escalation_reason": null,
  "escalation_level": "L1",
  "decision_record_id": "ADR-010",
  "tags": [
    "finops",
    "sales"
  ],
  "acceptance_criteria": [
    "Redazione del report di impatto economico e FinOps per lo Sprint 7",
    "Modellazione del ROI per i Brand basata sul risparmio ore-uomo nell'onboarding campionario",
    "Certificazione del rispetto del limite di costo-to-serve a 0 EUR per il tier laboratori",
    "Creazione dello script di vendita e demo kit per i commerciali B2B"
  ],
  "notes": "Analisi FinOps e go-to-market per la monetizzazione di Sprint 7."
}
