{
  "task_id": "FTL-CEO-023",
  "title": "➕ Nuovo Modello di Base (Forma & Costruzione)",
  "description": "Nel campo \"Riferimento CAD / Cartamodello 3D\" devo poter inserire un file allegato.",
  "status": "done",
  "priority": "medium",
  "assignee_role": "CEO",
  "assignee_agent": "footlink-ceo",
  "created_by": "Founder (Control Center)",
  "created_at": "2026-10-28T18:43:10+02:00",
  "updated_at": "2026-10-28T19:05:00+02:00",
  "due_date": "2026-11-27T23:59:59+02:00",
  "estimated_effort": "S (2-8h)",
  "actual_effort": "3h",
  "dependencies": [],
  "blocked_by": [],
  "output_artifacts": [
    "Applicativo/frontend/src/components/ProductModelsManager.tsx"
  ],
  "requires_escalation": false,
  "escalation_reason": null,
  "escalation_level": "L0",
  "decision_record_id": null,
  "tags": [
    "governance",
    "product"
  ],
  "acceptance_criteria": [
    "Aggiungo un nuovo modello di base e posso caricare in allegato il file CAD e 3D"
  ],
  "notes": "Iniziativa inserita dal Founder nel Control Center per triage e strutturazione CEO."
}
