{
  "task_id": "FTL-CEO-011",
  "title": "Sospensione Temporanea Modulo 02 Work Orders Hub (ADR-009) & Allineamento C-Suite",
  "description": "Formalizzare la decisione del Founder di porre in stand-by l'implementazione del 'Modulo 02 · Work Orders Hub & Size Matrix (ADR-008)', occultare la voce e il rendering dalla piattaforma UI, ed allineare l'intera C-Suite sulla riallocazione delle priorità verso l'Area Prodotti PLM, il PIM Hub e il Vault Conceria.",
  "status": "done",
  "priority": "high",
  "assignee_role": "CEO",
  "assignee_agent": "footlink-ceo",
  "created_by": "Founder (Control Center)",
  "created_at": "2026-10-19T19:15:23+02:00",
  "updated_at": "2026-10-19T19:37:56+02:00",
  "due_date": "2026-11-18T23:59:59+02:00",
  "estimated_effort": "M (1-3gg)",
  "actual_effort": "S (2-8h)",
  "dependencies": [],
  "blocked_by": [],
  "output_artifacts": [
    "Azienda/adr/ADR-009-pause-work-orders-hub-and-refocus-plm-pim-leather-vault.md",
    "Azienda/adr/README.md"
  ],
  "requires_escalation": false,
  "escalation_reason": null,
  "escalation_level": "L1",
  "decision_record_id": "ADR-009",
  "tags": [
    "governance",
    "product"
  ],
  "acceptance_criteria": [
    "Emissione e ratifica di ADR-009 per la sospensione temporanea del Modulo 02",
    "Occultamento visuale del Modulo 02 dalla barra di navigazione e dal router UI in App.tsx",
    "Allineamento del backlog della C-Suite con riallocazione dell'effort su PLM, PIM e Conceria",
    "Nessun impatto negativo sui dati preesistenti e salvaguardia dell'architettura commesse per il futuro"
  ],
  "notes": "Formalizzazione di governance completata dal CGO in ADR-009."
}
