{
  "task_id": "FTL-PROD-001",
  "title": "PRD Core MVP: Modello Dati 1:N PIM/PLM e Scheda Tecnica Filiera",
  "description": "Definire la specifica funzionale completa (PRD) dell'MVP di Footlink: modellare la relazione 1:N tra Articolo PIM (vendita) e Articoli PLM (produzione), mappare i campi per calzaturiero, pelletteria e abbigliamento (BOM multi-livello, materiali, terzisti) e definire i requisiti per il Passaporto Digitale del Prodotto (DPP).",
  "status": "done",
  "priority": "critical",
  "assignee_role": "CPO",
  "assignee_agent": "footlink-cpo",
  "created_by": "Founder",
  "created_at": "2026-10-18T02:00:00+02:00",
  "updated_at": "2026-10-18T02:54:00+02:00",
  "due_date": "2026-10-25T23:59:59+02:00",
  "estimated_effort": "L (3-10gg)",
  "actual_effort": "M (1gg)",
  "dependencies": ["FTL-GOV-001", "FTL-CEO-001"],
  "blocked_by": [],
  "output_artifacts": [
    "Azienda/docs/prd/PRD-001-mvp-pim-plm.md",
    "Azienda/adr/ADR-003-domain-model-1-to-n-pim-plm.md"
  ],
  "requires_escalation": false,
  "escalation_reason": null,
  "escalation_level": "L1",
  "decision_record_id": "ADR-003",
  "tags": ["PLM", "PIM", "product"],
  "acceptance_criteria": [
    "PRD dettagliata con user stories per Terzista, PMI e Brand",
    "Modello entità-relazione 1 Articolo PIM ↔ N Articoli PLM con BOM multi-livello",
    "Mappatura attributi Passaporto Digitale del Prodotto (DPP UE)",
    "Tabella di prioritizzazione RICE per le top-5 feature MVP"
  ],
  "notes": "Completati PRD-001-mvp-pim-plm.md (modello 1:N PIM/PLM, attributi calzature/pelletteria/abbigliamento, BOM multi-livello, UX Terzista Zero-Friction a 0€, mappatura DPP UE ESPR, User Stories Gherkin e RICE Score top-6 feature) e ADR-003-domain-model-1-to-n-pim-plm.md. Sbloccati FTL-REV-001 e FTL-MKT-001."
}
